{
  "endpoints": [],
  "payload_schemas": [],
  "events": [],
  "env_vars": [
    {
      "name": "REDIS_URL",
      "owner": "claude/hooks/tests/test_analyzer_services.py"
    },
    {
      "name": "STRIPE_SECRET_KEY",
      "owner": "claude/hooks/tests/test_analyzer_services.py"
    },
    {
      "name": "TWILIO_ACCOUNT_SID",
      "owner": "claude/hooks/tests/test_analyzer_services.py"
    }
  ],
  "legacy_contracts": [
    {
      "description": "o # LEGACY: en el código.\"\"\"",
      "file": "claude/hooks/analyzers/contract.py",
      "line": 253
    }
  ]
}
