{
  "endpoints": [],
  "payload_schemas": [],
  "events": [],
  "env_vars": [
    {
      "name": "REDIS_URL",
      "used_in": [
        "claude/hooks/tests/test_analyzer_services.py"
      ],
      "breaking_if_missing": true
    },
    {
      "name": "STRIPE_SECRET_KEY",
      "used_in": [
        "claude/hooks/tests/test_analyzer_services.py"
      ],
      "breaking_if_missing": true
    },
    {
      "name": "TWILIO_ACCOUNT_SID",
      "used_in": [
        "claude/hooks/tests/test_analyzer_services.py"
      ],
      "breaking_if_missing": true
    }
  ],
  "legacy_contracts": [
    {
      "description": "o # LEGACY: en el código.\"\"\"",
      "file": "claude/hooks/analyzers/contract.py",
      "line": 269
    }
  ]
}
